{
  "changes": [],
  "class": null,
  "family": "semantic",
  "from": "sha256:586367adca24fd17fb0ea4b085a2d77270c53849b616f4607c8143109f792fa0",
  "review_required": false,
  "schema": "vsf-diff-report-v1",
  "summary": {"additive":0,"breaking":0,"cosmetic":0,"permission":0,"unknown":0},
  "to": "sha256:586367adca24fd17fb0ea4b085a2d77270c53849b616f4607c8143109f792fa0"
}

